{
  "$schema": "http://json-schema.org/draft-07/schema#",
  "title": "The GTFS Realtime source schema of the Mobility Catalogs.",
  "type": "object",
  "properties": {
    "mdb_source_id": {
      "type": "number",
      "description": "Unique numerical identifier."
    },
    "data_type": {
      "type": "string",
      "description": "The data format that the source uses, e.g gtfs, gtfs-rt.",
      "enum": ["gtfs-rt"]
    },
    "entity_type": {
      "type": "array",
      "items": {
        "type": "string",
        "enum": ["vp", "tu", "sa"]
      },
      "description": "The feed entity types (abbreviated) available in the source: vp (vehicle positions), tu (trip updates) and sa (service alerts)."
    },
    "provider": {
      "type": "string",
      "description": "Name of the transit provider."
    },
    "name": {
      "type": "string",
      "description": "An optional description of the data source, e.g to specify if the data source is an aggregate of multiple providers, or which network is represented by the source."
    },
    "feed_contact_email": {
      "type": "string",
      "description": "An email to use to contact the provider of the feed."
    },
    "static_reference": {
      "type": "array",
      "items": {
        "type": "string"
      },
      "description": "A list of the static sources that the real time source is associated with, represented by their MDB source IDs. Although optional, if not provided, the location of this source will be set to unknown."
    },
    "features": {
      "type": "array",
      "description": "A list of features that the source supports.",
      "items": {
        "type": "string",
        "enum": ["occupancy"]
      }
    },
    "status": {
      "type": "string",
      "description": "The status of the source which can be used to determine if/how to include it in public trip-planning. If not provided, source is assumed to be active. Should be one of: active: The feed service is current. inactive: The source is inactive / hasn't been updated recently and should be included in public trip-planning at risk of providing outdated information. deprecated: The source is explicitly deprecated and should not be included in public trip-planning. development: The source is in development or being used to test a specific feature and should not be included in public trip-planning.",
      "enum": ["active","deprecated","inactive","development"]
    },
    "note": {
      "type": "string",
      "description": "A note to clarify complex use cases for consumers, for example when several static sources are represented in a realtime source."
    },
    "urls": {
      "type": "object",
      "properties": {
        "direct_download": {
          "type": "string",
          "description": "URL that automatically opens the source.",
          "pattern": "^(http|https|ftp):\/\/[a-zA-Z0-9.,~#{}():&/%='?_+/-]+$"
        },
        "authentication_type": {
          "type": "number",
          "description": "The authentication type of the source.",
          "enum": [
            0,
            1,
            2,
            3
          ]
        },
        "authentication_info": {
          "type": "string",
          "description": "If authentication is required, this field contains a URL to a human-readable page describing how the authentication should be performed and how credentials can be created. This field is required for `authentication_type=1` or greater.",
          "pattern": "^(http|https|ftp):\/\/[a-zA-Z0-9.,~#{}():&/%='?_+/-]+$"
        },
        "api_key_parameter_name": {
          "type": "string",
          "description": "This field defines the name of the parameter to pass in the URL to provide the API key. This field is required for `authentication_type=1` and `authentication_type=2`."
        },
        "license": {
          "type": "string",
          "description": "The transit provider’s license information.",
          "pattern": "^(http|https|ftp):\/\/[a-zA-Z0-9.,~#{}():&/%='?_+/-]+$"
        }
      },
      "oneOf": [
        {
          "not": {
            "required": [
              "authentication_type"
            ]
          }
        },
        {
          "allOf": [
            {
              "if": {
                "properties": {
                  "authentication_type": {
                    "enum": [
                      1,
                      2,
                      3
                    ]
                  }
                }
              },
              "then": {
                "required": [
                  "authentication_info"
                ]
              },
              "else": {
                "not": {
                  "required": [
                    "authentication_info"
                  ]
                }
              }
            },
            {
              "if": {
                "properties": {
                  "authentication_type": {
                    "enum": [
                      1,
                      2
                    ]
                  }
                }
              },
              "then": {
                "required": [
                  "api_key_parameter_name"
                ]
              },
              "else": {
                "not": {
                  "required": [
                    "api_key_parameter_name"
                  ]
                }
              }
            }
          ]
        }
      ],
      "required": [
        "direct_download"
      ]
    },
    "redirect": {
      "type": "array",
      "description": "A list of feed IDs that should be used as a replacement for this feed.",
      "items": {
        "type": "object",
        "properties": {
          "id": {
            "type": "string",
            "description": "The target feed id of that redirect."
          },
          "comment": {
            "type": "string",
            "description": "A comment explaining the redirect."
          }
        }
      }
    },
    "is_official": {
      "type": "string",
      "description": "True if a feed comes directly from the agency, False if a feed is created by researchers or partners unaffiliated with the agency or municipality.",
      "enum": ["True", "False"]
    },
    "is_producer_url_unstable": {
      "type": ["string", "null"],
      "description": "True if the producer URL is known to be unstable (e.g. changes frequently), False otherwise.",
      "enum": [null, "True", "False"]
    }
  },
  "required": ["mdb_source_id", "data_type", "entity_type", "provider", "urls"]
}
