{
    "mdb_source_id": 2229,
    "data_type": "gtfs-rt",
    "entity_type": [
        "vp"
    ],
    "provider": "Foothill Transit",
    "static_reference": [
        "101"
    ],
    "urls": {
        "direct_download": "https://foothill_3rdparty.rideralerts.com/myStop/GTFS-Realtime.ashx?&Type=VehiclePosition&serverid=0",
        "authentication_type": 0,
        "license": "https://www.foothilltransit.org/about/developer-resources/developer-license-agreement/"
    }
}