{
    "mdb_source_id": 2577,
    "data_type": "gtfs-rt",
    "entity_type": [
        "tu"
    ],
    "provider": "BC Transit (West Coast)",
    "is_official": "True",
    "static_reference": [
        "2575"
    ],
    "urls": {
        "direct_download": "https://bct.tmix.se/gtfs-realtime/tripupdates.pb?operatorIds=51",
        "authentication_type": 0,
        "license": "https://www.bctransit.com/open-data/terms-of-use"
    }
}
