{
    "mdb_source_id": 1627,
    "data_type": "gtfs-rt",
    "entity_type": [
        "tu"
    ],
    "provider": "Metropolitan Transit Authority (MTA)",
    "name": "Metro North Railroad",
    "static_reference": [
        "524"
    ],
    "urls": {
        "direct_download": "https://api-endpoint.mta.info/Dataservice/mtagtfsfeeds/mnr%2Fgtfs-mnr",
        "authentication_type": 0,
        "license": "https://api.mta.info/#/DataFeedAgreement"
    }
}