{
    "mdb_source_id": 1667,
    "data_type": "gtfs-rt",
    "entity_type": [
        "sa"
    ],
    "provider": "Regional Transportation Commission of Southern Nevada (RTC)",
    "static_reference": [
        "110"
    ],
    "urls": {
        "direct_download": "https://api.goswift.ly/real-time/las-vegas-rtc/gtfs-rt-alerts/",
        "authentication_type": 2,
        "authentication_info": "https://goswift.ly/realtime-api-key",
        "api_key_parameter_name": "authorization",
        "license": "https://www.goswift.ly/api-license"
    }
}