{
    "mdb_source_id": 1714,
    "data_type": "gtfs-rt",
    "entity_type": [
        "vp"
    ],
    "provider": "Port Authority of Allegheny County",
    "name": "Port Authority of Allegheny County Bus",
    "static_reference": [
        "409"
    ],
    "urls": {
        "direct_download": "https://truetime.portauthority.org/gtfsrt-bus/vehicles",
        "authentication_type": 0,
        "license": "https://www.portauthority.org/business-center/developer-resources/developer-license-agreement/"
    }
}