{
    "mdb_source_id": 3547,
    "data_type": "gtfs-rt",
    "is_official": "False",
    "entity_type": [
        "vp"
    ],
    "provider": "ACTV Automobilistico - BusOne",
    "static_reference": [
        "3590"
    ],
    "urls": {
        "direct_download": "https://proxy.busone.app/actv-aut/gtfs-rt/vehicle-positions.pb",
        "authentication_type": 0,
        "license": "https://proxy.busone.app/actv-aut/readme"
    }
}
