{
    "mdb_source_id": 3194,
    "data_type": "gtfs-rt",
    "is_official": "True", 
    "entity_type": [
        "sa"
    ],
    "provider": "CobbLinc",
    "feed_contact_email": "Cobblincis@cobbcounty.gov",
    "is_official": "True",
    "static_reference": [
        "3193"
    ],
    "urls": {
        "direct_download": "https://cobb.rideralerts.com/InfoPoint/GTFS-Realtime.ashx?Type=Alert&Debug=True",
        "authentication_type": 0
    }
}
