{
    "mdb_source_id": 3543,
    "data_type": "gtfs-rt",
    "entity_type": [
        "sa"
    ],
    "static_reference": [
        "3540"
    ],
    "is_official": "True",
    "provider": "Blagoevgrad Municipality Modeshift",
    "urls": {
        "direct_download": "https://api.modeshift.com/v1/tenants/d2835d46-0fbd-4d65-aa94-a17a6304b460/gtfsrtpartnerfeed/alerts.pb?",
        "authentication_type": 1,
        "api_key_parameter_name": "subscription-key",
        "authentication_info": "https://forms.office.com/e/EJ8tXaYFmV"
    },
    "redirect": []
}