{
    "mdb_source_id": 1404,
    "data_type": "gtfs-rt",
    "entity_type": [
        "tu"
    ],
    "provider": "BC Transit - Regional District of Nanaimo (RDN) Transit System",
    "status": "deprecated",
    "static_reference": [
        "692"
    ],
    "urls": {
        "direct_download": "http://nanaimo.mapstrat.com/current/gtfrealtime_TripUpdates.bin",
        "authentication_type": 0,
        "license": "https://www.bctransit.com/open-data/terms-of-use"
    },
    "redirect": [
        {
            "id": "2475",
            "comment": " "
        }
    ]
}
