{
    "mdb_source_id": 3570,
    "data_type": "gtfs-rt",
    "is_official": "False",
    "entity_type": [
        "tu"
    ],
    "provider": "Trenitalia - BusOne",
    "static_reference": [
        "3569"
    ],
    "urls": {
        "direct_download": "https://proxy.busone.app/trenitalia/gtfs-rt/trip-updates.pb",
        "authentication_type": 0,
        "license": "https://proxy.busone.app/trenitalia/readme"
    }
}
