{
    "mdb_source_id": 1383,
    "data_type": "gtfs-rt",
    "entity_type": [
        "sa"
    ],
    "provider": "Barrie Transit",
    "static_reference": [
        "3"
    ],
    "urls": {
        "direct_download": "http://www.myridebarrie.ca/gtfs/GTFS_ServiceAlerts.pb",
        "authentication_type": 0
    }
}