{
    "mdb_source_id": 3511,
    "data_type": "gtfs-rt",
    "entity_type": [
        "vp"
    ],
    "name": "ArroyoBus",
    "provider": "La Regional Vallisoletana S.A",
    "is_official": "True",
    "static_reference": [
        "3508"
    ],
    "urls": {
        "direct_download": "https://enzeyiwpoomhlxmcjivn.supabase.co/functions/v1/gtfs-rt",
        "authentication_type": 0
    }
}