{
    "mdb_source_id": 1379,
    "data_type": "gtfs-rt",
    "entity_type": [
        "vp"
    ],
    "provider": "BC Transit (Cowichan Valley Regional Transit System)",
    "status": "deprecated",
    "static_reference": [
        "694"
    ],
    "urls": {
        "direct_download": "https://bct.tmix.se/gtfs-realtime/vehicleupdates.pb?operatorIds=10",
        "authentication_type": 0
    },
    "redirect": [
        {
            "id": "2531",
            "comment": " "
        }
    ]
}
