{
    "mdb_source_id": 2625,
    "data_type": "gtfs-rt",
    "entity_type": [
        "vp"
    ],
    "provider": "Transports Bordeaux MÃ©tropole (TBM)",
    "is_official": "True", 
    "static_reference": [
        "2622"
    ],
    "urls": {
        "direct_download": "https://bdx.mecatran.com/utw/ws/gtfsfeed/vehicles/bordeaux?apiKey=opendata-bordeaux-metropole-flux-gtfs-rt",
        "authentication_type": 0,
        "license": "https://transport.data.gouv.fr/datasets/offres-de-services-bus-tram-et-scolaire-au-format-gtfs-gtfs-rt-siri-lite-1"
    }
}
