{
    "mdb_source_id": 2599,
    "data_type": "gtfs-rt",
    "is_official": "True",
    "entity_type": [
        "sa"
    ],
    "provider": "Zarząd Transportu Publicznego w Krakowie (ZTP Kraków)",
    "note": "Aggregate",
    "static_reference": [
        "2598",
        "1270",
        "1326"
    ],
    "urls": {
        "direct_download": "https://gtfs.ztp.krakow.pl/ServiceAlerts.pb",
        "authentication_type": 0
    }
}
