{
    "mdb_source_id": 2230,
    "data_type": "gtfs-rt",
    "entity_type": [
        "tu"
    ],
    "provider": "Foothill Transit",
    "urls": {
        "direct_download": "https://foothill_3rdparty.rideralerts.com/myStop/GTFS-Realtime.ashx?&Type=TripUpdate",
        "authentication_type": 0,
        "license": "https://www.foothilltransit.org/about/developer-resources/developer-license-agreement/"
    }
}