{
    "mdb_source_id": 3336,
    "data_type": "gtfs-rt",
    "entity_type": [
        "vp"
    ],
    "provider": "X-trafik",
    "is_official": "True",
    "static_reference": [
        "3253"
    ],
    "urls": {
        "direct_download": "https://opendata.samtrafiken.se/gtfs-rt/xt/VehiclePositions.pb",
        "authentication_type": 1,
        "authentication_info": "https://developer.trafiklab.se/register",
        "api_key_parameter_name": "key",
        "license": "https://www.trafiklab.se/api/gtfs-datasets/gtfs-regional/#licence"
    }
}
