{
    "mdb_source_id": 2124,
    "data_type": "gtfs-rt",
    "entity_type": [
        "tu"
    ],
    "provider": "Ben Franklin Transit",
    "static_reference": [
        "2122"
    ],
    "urls": {
        "direct_download": "https://myride.bft.org/Realtime/GTFS_TripUpdates.pb",
        "authentication_type": 0
    }
}
